[
  {
    "id": "sc-ysjf-creator",
    "platform": "bilibili",
    "source_type": "followed_creator",
    "identifier": "946974",
    "display_name": "影视飓风",
    "download_strategy": "full_video",
    "auto_compile": true,
    "max_items": 10,
    "schedule": "0 8,20 * * *",
    "enabled": true,
    "user_id": "admin",
    "created_at": "2026-05-01T00:00:00.000Z",
    "updated_at": "2026-05-01T00:00:00.000Z"
  },
  {
    "id": "sc-lau-creator",
    "platform": "bilibili",
    "source_type": "followed_creator",
    "identifier": "630560038",
    "display_name": "Lau博士的云组会",
    "download_strategy": "full_video",
    "auto_compile": true,
    "max_items": 10,
    "schedule": "0 8,20 * * *",
    "enabled": true,
    "user_id": "admin",
    "created_at": "2026-05-01T00:00:00.000Z",
    "updated_at": "2026-05-01T00:00:00.000Z"
  },
  {
    "id": "sc-ai-hot",
    "platform": "bilibili",
    "source_type": "keyword_hot",
    "identifier": "人工智能",
    "display_name": "AI 热门视频",
    "download_strategy": "subtitle_only",
    "auto_compile": true,
    "max_items": 20,
    "schedule": "0 10 * * *",
    "enabled": true,
    "user_id": "admin",
    "created_at": "2026-05-01T00:00:00.000Z",
    "updated_at": "2026-05-01T00:00:00.000Z"
  }
]
